{
  "schema_version": "eusp-participation-mode/v1",
  "synthetic": true,
  "fixture_notice": "This is a fabricated, anonymized public evaluation fixture. It contains no real person, profile, account, behaviour, or source snapshot.",
  "snapshot_date": "2026-08-30",
  "candidates": [
    {"id": "pm-open-call", "classification": "ACT_NOW", "baseline_priority": 100, "relevance_proxy": 90, "readiness_score": 100, "minutes_max": 40, "gates": {"grounding": "pass", "liveness": "pass", "actionability": "pass"}, "participation_mode": {"id": "open-call", "non_obvious": false}, "readiness_checks": {"profile_bridge": true, "local_deliverable": true, "seven_day_start": true, "bounded_effort": true, "blockers_disclosed": true}, "evidence": [{"claim": "A fictional institute has an open call.", "quote": "The 2026 fictional open call is open; prepare a local one-page outline before the deadline.", "url": "https://example.test/fictional-institute/open-call", "retrieved_at": "2026-08-30T09:00:00Z", "source_type": "direct_official_primary", "current_status": "open", "temporal": {"kind": "deadline", "date": "2026-09-20"}, "supports": ["participation_route", "participation_mode:open-call"]}]},
    {"id": "pm-standard-workshop", "classification": "PREPARE_NEXT", "baseline_priority": 90, "relevance_proxy": 88, "readiness_score": 100, "minutes_max": 40, "gates": {"grounding": "pass", "liveness": "pass", "actionability": "pass"}, "participation_mode": {"id": "standard-workshop", "non_obvious": false}, "readiness_checks": {"profile_bridge": true, "local_deliverable": true, "seven_day_start": true, "bounded_effort": true, "blockers_disclosed": true}, "evidence": [{"claim": "A fictional institute has a current workshop route.", "quote": "Registering for the fictional workshop is open; prepare a local topic note before the deadline.", "url": "https://example.test/fictional-institute/workshop", "retrieved_at": "2026-08-30T09:01:00Z", "source_type": "direct_official_primary", "current_status": "open", "temporal": {"kind": "deadline", "date": "2026-09-18"}, "supports": ["participation_route", "participation_mode:standard-workshop"]}]},
    {"id": "pm-contribution-sprint", "classification": "ACT_NOW", "baseline_priority": 80, "relevance_proxy": 88, "readiness_score": 100, "minutes_max": 40, "gates": {"grounding": "pass", "liveness": "pass", "actionability": "pass"}, "participation_mode": {"id": "contribution-sprint", "non_obvious": true}, "readiness_checks": {"profile_bridge": true, "local_deliverable": true, "seven_day_start": true, "bounded_effort": true, "blockers_disclosed": true}, "evidence": [{"claim": "A fictional institute has a current contribution-sprint participation route.", "quote": "The fictional contribution sprint is open: participants prepare a local proposal fragment for the current sprint window.", "url": "https://example.test/fictional-institute/contribution-sprint", "retrieved_at": "2026-08-30T09:02:00Z", "source_type": "direct_official_primary", "current_status": "open", "temporal": {"kind": "rolling", "end_date": "2026-09-30"}, "supports": ["participation_route", "participation_mode:contribution-sprint"]}]},
    {"id": "pm-stale-route", "classification": "ACT_NOW", "baseline_priority": 95, "relevance_proxy": 95, "readiness_score": 100, "minutes_max": 40, "gates": {"grounding": "pass", "liveness": "fail", "actionability": "pass"}, "participation_mode": {"id": "open-call", "non_obvious": false}, "readiness_checks": {"profile_bridge": true, "local_deliverable": true, "seven_day_start": true, "bounded_effort": true, "blockers_disclosed": true}, "evidence": [{"claim": "A fictional institute previously had an open call.", "quote": "The fictional open call closed on 2026-08-01.", "url": "https://example.test/fictional-institute/closed-call", "retrieved_at": "2026-08-30T09:03:00Z", "source_type": "direct_official_primary", "current_status": "closed", "temporal": {"kind": "deadline", "date": "2026-08-01"}, "supports": ["participation_route", "participation_mode:open-call"]}]}
  ],
  "controls": {
    "baseline": {"frozen_input_id": "pm-fixture-input/v1", "frozen_input_sha256": "e71eda1fe8093ee03560403b393eead6131ebd6b8f1db321019efe201082ef6a", "source_research_budget": {"max_primary_source_records": 4}, "report_budget": {"max_candidates_rendered": 4}, "action_capacity": 2, "weekly_minutes_cap": 120},
    "intervention": {"frozen_input_id": "pm-fixture-input/v1", "frozen_input_sha256": "e71eda1fe8093ee03560403b393eead6131ebd6b8f1db321019efe201082ef6a", "source_research_budget": {"max_primary_source_records": 4}, "report_budget": {"max_candidates_rendered": 4}, "action_capacity": 2, "weekly_minutes_cap": 120, "non_obvious_mode_bonus": 15}
  },
  "failure_condition": {"minimum_mode_novelty_delta": 0.01, "minimum_relevance_delta": 0, "minimum_readiness_delta": 0, "minimum_grounding_rate": 1}
}
